8인실로 예약 가능한가요?	8인실은 예약 가능해요
아메리카노 말고 뭐가 잘나가요?	아주머니들 많이 있는 곳에는 라떼가 좀 많이 나가고 오피스 지역은 아메리카노가 잘 나갑니다
회원들한테?	회원들한테는 5프로, 10프로 같은 할인 쿠폰도 하나 드려요
네 그럼 120분 이용할게요	3천 원입니다
마약빵이 이거에요?	누르지 마세요
메뉴판 따로 있어요?	위에 보시고 주문하시면 돼요
불고기용 고기 한우에요?	국내산이에요
그러면 딸기 알 큰 걸로 두 접시 주세요.	잠시만 기다리세요.
시간이 얼마나 걸릴까요?	15분정도만 기다려주세요
양장피는 뭐예요?	돼지고기 삼선 해물 야채를 여러 가지 채로 모양내서 양장피라는게 있거든요 그걸 삶아서 만든거에요
얼마나 드릴까요?	천원 어치만 주세요
여자인 나도 같이 입어도 될거 같은데요?	같이 입어도 돼요
이거는 무슨 물이에요 먹어도 되는 건가?	손님 드리려고 오가피 물이에요
카카오페이 가능하죠?	바코드 입력해주세요
여기는 오픈하신지 얼마쯤 되셨어요?	5년 넘었어요
체격이 마른 편인가요?	마른 편이에요
오늘 어떤 고기가 좋나요?	오늘은 돼지고기가 신선해요
고기 주세요	저희는 야채는 없고 고기만 드릴게요
이 딸기가 제일 큰 딸기죠?	딸기 중에 제일 큰 딸기예요
네 선물포장비가 따로 있나요?	선물포장비 1000원 추가됩니다
컴퓨터 사양은 베틀그라운드 그런 거는 다 돌아갈 정도 되나요?	최고 사양이나 그런 거는 아니지만 기본적인 건 다 돌아갑니다
그러면 메뉴는 어떤 걸로 하면 될까요?	지금 배달의 민족 들어가셔서 사천성 메뉴 보시고 결정해주시면 될 거 같아요
화장실좀 갔다올게요	금방 해드리겠습니다
카드 결제 가능할까요?	가능합니다
너무 길어요	다른 귀걸이 보여줄게요
여기 문 연지는 오래됐어요?	한 6개월 넘었어요
여기 몇 시까지해요?	11시 50분까지 합니다
이거는 몇 등급 가죽이에요?	이 가죽은 2등급 정도 돼요
며칠까지 휴무예요?	설까지 쉬고 다음날 열 거 같아요
영수증은 안 주셔도 됩니다	그럴게요
어떤 색상이 잘나가요?	곤색, 회색이 가장 잘나가는 색이에요
가격은 얼마에요?	이거는 십사만 구천 원인데 이십 프로 해드릴게요
몇 팩 사면 좀 깎아주시나요?	세 팩하시면 5000원에 드려요
요 티는 얼마예요?	이 티는 삼만 칠천 원이고, 저 티는 이만 오천 원이에요
9미리로 밀어도 될까요?	5미리는 너무 짧고 보통 9미리로 많이 하세요
가방버튼이 고장나서 안잠겨요	한번 살펴봐야 할 것 같아요
머리 기장이 어깨일 경우에 염색 가격이 얼마인가요?	어깨 기장까지 염색하시면 34만 원정도 나옵니다
성인 둘 아기 한 명이 사용할 스위트룸 있나요?	스위트룸 자리 있어요
청소년들도 이용을 많이 하는 편인가요?	청소년 손님은 잘 없어요
시루떡 사이즈가 얼마나 돼요?	시루떡은 사이즈가 다 비슷해요
a방이랑 b방 각각 뷰가 어떻게 되죠?	a방은 고층 도시 풍경이고 b방은 해변이 보여요
등심은 얼마나 드릴까요?	고기는 1kg 넘지 않게 주세요
쿠키 선물할 거 있어요?	쿠키는 이쪽에 선물용 세트가 준비되어 있습니다
새로운 신발들 좀 볼 수 있을까요?	이번 봄에 특히 예쁜 신발이 많이 나왔어요
코트 형태를 고쳐도 상관은 없는데 얼마 들어요?	코트 리폼 비용은 보통 사만 원입니다
이 제품은 얼마예요?	그 제품 삼만 오천 원인데 라지사이즈 하나 남았어요
이번 주 토요일에 1박 하고 싶은데 예약될까요?	가능해요
후드 집업은 몇 층에 있나요?	3층 왼쪽 코너 보시면 있을겁니다
대실은 얼마인가요?	대실 비용은 2만 원이에요
네 그럼 먼저 음료수 좀 주세요	잠시만 기다리세요
총 6명인데, 방 개수는 하나로 하고 싶은 데 될까요?	4인 방에 2인 추가 요금 내시고 쓰면 됩니다
쿠폰 10개 모으면 음료 종류 상관없이 한 잔 무료예요?	아뇨 아메리카노 하나만 가능하세요
이렇게 아무리 눌러도 인식이 안돼요	그러면 제가 다른 자리로 바꿔드릴게요
무릎에 연골이 많이 닳아서 주사도 맞고 그랬는데 무릎 연골쪽으로 영양제 같은 거 있나요?	무릎 연골쪽으로 영양제 있어요
가죽 말고 메탈은 없나요?	메탈에서는 이게 제일 잘나가요
나이 들었는데 이런 거 신어도 돼요?	괜찮아요 이런 거 금색도 있어요
색깔은 뭐 있어요?	회색 한 장 있어요
as기간은 얼마나 되요?	무상은 1년입니다
혹시 시식도 가능한가요?	죄송하지만 두제품은 시식이 따로 마련되있지 않아요
클렌징 제품은 어디에 있나요?	이쪽에 있어요
저는 귓볼이 두꺼워서 가리고 싶은데 귀찌 같은거 있나요?	귀찌는 없어요
롱코트 잘라서 짧은 자켓으로 만드려는데 얼마 정도 해요?	주머니 위치에 따라 다른데 2만원부터 합니다
화장실 어디 있어요?	화장실 안쪽으로 가시면 있습니다
머플러 큰 사이즈랑 캐시미어 코트 좀 변형없이 잘해 주실 수 있으신가 해서요	변형 없이 가능합니다
포인트 적립되죠?	전화번호 알려주세요
6시간 대실하면 좀 깎아주나요?	6시간은 대실하시면 할인해서 5만 원만 받을게요
성함이 어떻게 되시나요?	김종우로 예약했습니다
예약자분 성함이 어떻게 되세요?	홍길동입니다
차량 번호 알려주세요	5052입니다
카드 가격인가요?	카드 현찰 똑같습니다
음식 주문은 선불인가요?	후불입니다
호텔 위치가 어떻게 되나요?	강원도 속초시 속초 경찰서 인근에 있어요
이바지떡 주문하려고 하는데요.	이바지떡 주문 가능합니다.
감기 증상이 어떠세요?	온몸에 오한이 나고 콧물도 나고 재채기도 나요
PC 사용료는 어떻게 돼요?	30분당 1500원입니다
이 검은색 스웨터 스몰 사이즈가 있나요?	검은색은 없고 파란색은 있습니다
사우나 있다고 하셨는데 언제 이용이 가능해요?	사우나는 여섯 시부터 여덟 시까지 이용이 가능하세요
적립은 없으세요?	없어요
귤 잔거 저 앞에 있나요?	잔 귤은 저쪽에 있어요.
여기 있는 게 이게 어떤 제품이라고 했어요?	신상 제품이에요. 촉촉한데, 어둡고 차분한 색깔이에요
전문의약품보다 일반의약품이 더 안전한가요?	효과가 검증된거는 일반의약품이 더 검증이 되었습니다
네 이렇게요?	제가 알러지 반응을 해보도록 할게요 잠시만요
이 옷 현금으로 사면 할인 좀 해주시나요?	그 옷 현금으로 구매하시면 오만 사천원까지 할인해드릴게요
그리고 만두 추가해주세요	12번 자리로 가져다드릴게요
사과 얼마인가요?	아오리 사과는 5개에 5천 원이고, 홍사과는 5개에 3천 원이에요.
아무래도 숱은 좀 쳐주면 더 가벼운 느낌이라서요	그럼 알아서 잘해주세요
이 가방 소재가 어떤건가요?	소가죽으로 만들어진 가방입니다
영수증 좀 주실래요?	영수증 뽑아 드릴게요
추어탕은 얼마에요?	칠천 원이요
된장찌개 차돌 된장찌개 얼마?	구천원 이에요
배추는 어떻게 하는데?	배추김치는 큰 포기, 한 개에 만사천원이에요
거기 가면, 대게 먹을 데는 많나요?	주변에 대게 먹을 식당은 많아요
딸기는 가격이 어떻게 하나요?	딸기는 1킬로에 8000원이에요.
분리수거는 어디에서 하나요?	관리사무소 옆 분리수거장을 이용해주세요
진통제 있나요?	있습니다
차는 어디다 세워요?	뒤에 유료주차장이나 뒤에 골목에 대셔야 해요
대실은 얼마인가요?	대실은 기본 30000원이에요
현금 결제 부탁드릴게요	만 원 주셨어요
카드, 현금 똑같나요?	동일하고, 제가 드리는 약은 구십알 한 세트고, 가격은 사백만 원, 사백 오십만 원이라서 전부 드시기는 부담 되실꺼에요
치즈 조각 케이크 있나요?	있습니다
텐트, 한 동 치는데 얼마에요?	텐트 치면, 큰 거는 삼만원 작은 거는 이만원이요
루즈 종류 어디 있어요?	립스틱은 4가지가 있어요. 촉촉한 타입이랑 매트한 타입이 있어요
작년 십이월에 시작하셨어요?	아뇨 이월에요
포장인가요?	여기서 먹고 가려고요
이런 거 실크입니까?	실크 아니예요
오늘의 커피는 뭐에요?	오늘의 커피는 드립으로 내리는 커피에요
비타민 C요?	비타민 C는 없어요
저희 바비큐 하려고 하는데 숯이랑 석쇠 어떻게 해야 하나요?	저희가 저녁시간쯤 준비해 드릴게요
캐라반은 사용할 수 있나요?	캐라반 있으면 가능해요
몇 사이즈 드릴까요?	요거 이백사십예
인원은 몇 명인 가요?	5명입니다
카드 결제할게요	결제 도와드리겠습니다
쿠폰 같은 건 없나요?	쿠폰은 하고 있지 않아요
결제는 카드나 현금 상관없나요?	상관없습니다
두꺼운 잠바로 하셔야 돼요?	얇은 잠바로 찾고 있어요
여기는 몇 시까지 해요?	주문 마감은 9시 40분까지예요
하양 이쪽은 배달 다 되지요?	다는 안 됩니다
요금은 10분에 얼마에요?	10분에 중대는 1500원 받아요
안심 500g만 주세요	소고기 안심 500g 드릴게요
여기 짜장면 1개랑 짬뽕 곱배기 1개 배달 되나요?	가능합니다.
립스틱 종류좀 볼 수 있을까요?	여기 세가지 타입 있습니다
쌀을 전날 가지고 오면 되죠?	인절미 쌀은 오늘 가져오셔야 돼요
술도 하신다 그죠?	술도 팔죠
어떤 색으로 해 드릴까요?	밝은 색으로 하고 싶어요
색상이 다른 것도 있나요?	아이보리하고 핑크 있어요
돈가스 만들려고 하는데 돼지고기 어느 부위로 하면 될까요?	돈가스에는 등심이나 안심이 좋아요
흉터를 없애려면 초기에 해야 하는데 가렵거나 아프세요?	가려운 단계는 지난 것 같고
음료수는 서비스인가요?	원하시는 만큼 드셔도 됩니다
오늘 만든 반찬인가요?	김치 제외하고는 다 당일에 만든 반찬입니다
그냥 영양제보다 더 저렴하죠?	약효도 그냥 영양제보다 더 확실해요
평일에는 몇 시까지 하세요?	평일은 일곱 시까지 영업합니다
김밥 어떤 게 맛있어요?	잘 나가는 건 돈가스 김밥이 제일 잘나가고요
영수증 버려드릴까요?	주세요
그리고 국민카드 하시면 지금 적립 두배 됩니다	여기 있습니다
아이라이너 어디 있나요?	이 제품이 요즘 인기가 좋아요
결제는 미리 하고 갈 건데요?	결제는 미리 해주세요
삼선짬뽕 주세요	잠시만 기다려 주세요
생과일 주스도 가능해요?	지금은 생과일 주스는 키위만 가능합니다
아메리카노 레귤러보다 더 작은건 없나요?	레귤러가 제일 작은거에요
김치볶음밥 주문할게요	10분 뒤에 자리로 가져다드릴게요
얼마나 기다려야 하나요?	한 5분 정도면 자리가 납니다
언제부터 그러셨나요?	그저께부터 시작됐어요
어떤 선크림이 더 많이 나가요?	많이 나가는 선크림은 닥터지가 제일 많이 나가요
밖에 있는 거랑 이거랑은 디자인 좀 비슷한 건가요?	비슷해요
3만원짜리 한 박스에는 몇 개쯤 들어 있어요?	한 박스에 38개 들어 있는데 박스마다 달라요. 크기가 크면 개수가 줄어요.
포인트 결제하는 거는 CJ포인트 밖에 없나 봐요?	삼성카드나 현대M 카드도 포인트 있으면 사용 가능합니다
곰국 금방 삶은거죠?	이 곰국은 어제부터 삶은 거예요
풀장이 있나요?	공동 풀장은 있어요
저기 주문은 기계로만 해야 돼요?	카드는 저기서 하시면 돼요
네. 드시고 가세요?	아 네 먹고 갈 거에요
선불로 시간 충전 3시간 하겠습니다	회원제 할인으로 3000원 되겠습니다
쿠폰도 찍어주세요	알겠습니다
혹시 주차할 곳은 어디에 있나요?	여기 주차하시면 돼요
이월 상품은 어디있나요?	오른쪽 코너에 있습니다.
성인이신가요?	성인 맞습니다
키오스크로만 주문해야 하나요?	현재는 키오스크로만 주문 가능합니다.
점심 특선이 따로 있나요?	있습니다.
제가 물약은 잘 못 먹는데 알약만 먹어도 될까요?	물약이 흡수가 더 빨라서 같이 드시는 게 효과가 더 좋아요
엄청 뜨는 머리는 다운펌을 하면 돼요? 저처럼 이렇게 뒤집어지는 거 말하죠, 그거랑은 달라요?	다운펌은 남자들 아이롱으로 하는 파마에요
여기 일요일은 영업 안하나요?	일요일은 휴업입니다
많이 달겠네요?	많이 달아요
메추리알 장조림 하나에 얼마인가요?	6000원입니다
이건 향수가 아니라 샤워코롱이죠?	근데 옷 위에 뿌리고 요새는 향수보다 샤워코롱같은 걸 많이 뿌려요
이건 2만 원이에요?	지금 할인하고 있어서 1만 6000원요
조끼랑 세트로 파는 거예요?	세트로 파는데 개별로도 구매 가능해요
몇 시부터 몇 시까지 해요?	오전 11시부터 오후 9시까지 영업합니다
요 제품도 여성용인가요?	여성용이에요
양복 수선 해주시나요?	품 수선은 안됩니다
심플한거 좋아하세요?	이쁜 귀걸이 많네요
단화는 내피로 안에 털 넣을 수 있고?	단화는 신발 안 쪽까지 털 넣을 수 있어요
밑에 떡케이크는 그냥 떡으로 만들었어요?	떡케이크는 다 찰떡이에요
이 사과는 언제 들어온 거예요?	오늘 아침에 청과 도매시장에서 들어온 거에요.
평소에 쓰시는 제품 있으세요?	처음 써봐요
떡할 쌀 가져와도 되요?	쌀은 하루 전에 가져오셔야 해요
반찬요	반찬은 좀 있다가 드릴께요
딸기도 사려고 하는데 디스카운트 되나요?	딸기도 사시면 조금 깍아드릴게요.
아침에는 몇 시에 문 여시는데요?	오전 9시에 오픈합니다
그럼 내일모레 회사로 배송해주실 수 있나요?	알겠습니다.
저녁에는 가격이 달라지는 거에요?	아뇨 런치 때도 이 가격으로 드실 수 있어요
휴대용 인덕션에 구워 먹기에는 갈비가 너무 두꺼우려나?	갈비가 뼈가 있다 보니까 그냥 양은냄비에 넣고 끓여 먹으면 제일 좋습니다
주스 어떤 종류 있나요?	딸기주스 바나나주스 파인애플주스가 있습니다
여기 카페트 같은거는 여기서 하나요?	안하고 하청줘요
체크인하려고요	더블 싱글룸으로 예약하신 걸로 확인되세요
요게 진정이에요? 이 팩은 가격이 얼마예요?	이 팩은 한 개에 2천원이에요
커플석이라든지 그런 건 있나요?	커플석은 없습니다
이거는 인디핑크라 카든가?	맞아요
컬은 어떤 느낌을 원하세요?	묶었다 풀은 느낌으로 최대한 자연스럽게요
양송이는 몇 개 단위로 판매하고 있나요?	8개 들이 한 팩으로 팔고 있어요.
혹시 주차장 있나요?	건물 지하 1층에 주차장 있습니다
계산 좀 해주세요	이만팔천오백 원이요
남자들 가방 크로스로 메는거 큰 거 있어요?	큰 사이즈 가방은 여기에 있습니다
영수증 드릴까요?	영수증 주세요
무슨 세트요?	여기 세 가지 세트가 원래 오천구백 원인데 할인하는 거예요
많이 달지 않나요?	많이 달지 않습니다
단무지 좀 많이 갖다주세요	알겠습니다
우선 가방 흰 색으로 하나 주세요	결제 도와드릴게요
한우 삼겹살 어때요?	그건 맛이 없어요
네 성함이 어떻게 되시죠?	김유미입니다
보석은 싫으세요?	그건 흥미없고
현금영수증 해드릴까요?	그럼 번호 입력해주세요
해물짬뽕에 어떤 거 들어가요?	해물 여러 가지 들어가요
그릇은 일회용인가요	수거하는 그릇에 배달해드립니다
요 색깔하고 뭐 있어요?	보라색 있어요
네 이걸로 주세요	15만원 입니다
굽 높이도 있습니까?	안전화라서 굽은 없어요
창가쪽으로 조용한 자리 부탁합니다	알겠습니다
케이크 어디 있나요?	케이크는 냉장고에 비치되어 있어요
배는 한 상자에 얼마씩 해요?	배는 한 상자에 이만팔천 원이에요.
사장님, 차는 앞에 세워놔도 괜찮아요?	괜찮은데, 다른 가게에서 빼달라고 할 수 있습니다
이발하려고 하는데 가능한가요?	조금만 기다려주세요
여기 카카오페이 결제도 되는가요?	그거는 안해봤는데 모르겠어요
다른 사람들의 평이 어떤가요?	요즘 맛있다고 소문이 나서 주문이 많아요
그럼 어묵도 2개 같이 주세요	그럴게요
벌집 피자는 몇 명 정도 먹을 수 있어요?	한 두 세명 정도요
딸기 얼만가요?	딸기 한 박스에 7000원이에요.
인절미는 찹쌀이 들어가요?	인절미는 찹쌀이 들어가요
혹시 룸은  자리가 없나요?	룸은 예약하셔야 이용가능합니다
고사를 언제 하시는 거예요?	한 번 물어보고 얼마하는지 떡을 잘 안해보니까 요새는
보통 어떤 떡으로 구성하나요?	미니 백설기 꿀떡 쑥떡 등 원하시는 떡으로 조합해 드려요
핸드폰 번호로 부르겠습니다	불러주세요
포켓볼 대가 있나요?	제일 끝 쪽에 한자리가 있습니다
미백 성분은 다 들어가 있나요?	기본적으로 미백, 주름 개선은 다 돼요. 미백만 하시려면 미백크림을 따로 사셔야 하고요
매운김밥은 많이 매워요?	청양고추 들어갑니다
이게 그러면 끈 요게 조금 도금이다 그죠?	그렇죠
주차는 어디에 하면 돼요?	오늘은 공휴일이라서 뒤에 축협 쪽에 가면 차 댈 데 많이 있어요
외부음식도 주문할 수 있나요?	외부음식은 주문하실 수 없으세요
보관을 어떻게 해야 하나요?	서늘한 곳에 보관하시면 돼요
제가 견과류는 못 먹어요	견과류 안 들어간 것 알려드릴게요
네, 어떤 방으로 드릴까요?	더블룸으로 주세요
믹스동 2 하나는 포장 되나요?	진동벨 울리면 음식 가져가세요
선물 포장 가능한가요?	구매하신 제품을 들고 우측 테이블로 가시면 무료로 해드려요
이런 거는 얼마라고요?	88000원입니다
시럽 넣어드릴까요?	3번 펌핑해주세요
바비큐 세팅도 같이 할 수 있을까요?	바비큐도 이용 가능해요
제일 작은 사이즈에요?	가장 기본 사이즈고 따뜻한 건 한 단계 작은 사이즈가 또 있어요
네 그럼 짜장면 두개하고 탕수육 소짜리 주문할게요	금방 갖다드릴게요
물티슈 좀 가져다 주세요	알겠습니다
알겠습니다, 고민해보고 다시 전화드리겠습니다	전화 꼭 주세요
술이 달린 액세서리인데 없나요?	술 종류는 없어요
어디에 패딩이 있어요?	여기, 이 옷도 있어요
이쪽도 다 쿠키 종류네요?	다 쿠키 종류예요
지금 배달 가능한가요?	가능합니다.
메뉴판을 미리 볼 수 있을까요?	가져다 드리겠습니다
현금으로 하면 좀 싼가요?	조금 dc 해드려요
이 단화는 얼마인데요?	삼만 삼천 원인데 현금하시면 삼만 원까지 해드려요
현금하면 좀 할인해주세요?	그렇게 하세요
리폼도 가능한가요?	가능하지만 실물 확인해야 수선 여부를 알 수 있습니다
포켓볼 자리 있나요?	빈자리 가서 사용하시면 됩니다
원터치로 보여드릴까요?	원터치로 좀 붙는 걸로
청사과도 있나요?	있습니다.
사과 낱개로 구매 가능한가요?	죄송하지만 낱개로는 팔지 않아요.
여기 쿠폰 도장 찍어주세요	2개 찍어드렸고 진동벨로 알려드리겠습니다
어떤 음료가 있죠?	매실차랑 탄산음료 있어요
알러지가 있어서 은침으로 보여주시겠어요?	제일 인기 있는 제품은 이거에요
혹시 카드결제도 가능한가요?	그럼요.
수선 가격은 대략 얼마에요?	지금 정확한 비용은 확인이 어렵고, 수선물을 가져오셔야 확인이 가능합니다
혹시 휘핑크림 추가되나요?	500원 추가하시면 추가돼요
저 돼지등뼈는 얼마 해요?	저 돼지등뼈는 삼천원이요
삼겹살 두 근 주세요	삼겹살, 두 근 잘라 드릴게요
여기 박힌 거는 뭐예요?	큐빅이예요
이건 가방 재질이 뭐예요?	이게 아주 좋은 원단 피브이씨라고 있어요
이틀 사용으로 예약하셨네요?	맞습니다
혹시 자리에서 음식 주문이라든지 이런 건 할 수 있나요?	자리에서 음식 주문 가능합니다
네 어디십니까	상인대성 스카이렉스 102동 1503호요
카드도 결제되고요?	가능하시는데 7만원 이하는 수수료가 있으세요
조금 더 저렴한 것 있나요?	이쪽은 이월 상품인데 세일 중이에요
메뉴판 좀	여기 있습니다
아직 일행이 안와서 그런데 조금 이따가 주문해도 될까요?	그럼 일행분 오시면 불러주세요
이거 한 박스에 얼만에요?	한 박스에 사만원이에요.
헌금으로 사도 마찬가지예요?	현금하시면 3만 원만 주세요
네이비네요 저런 건 너무 두꺼워 보인다고 해야되나?	삼월까지는 꽃샘추위가 있어서 두꺼워도 입을 수 있어요
몇 시까지 체크아웃 해야 하나요?	내일 오전 11시까지 체크아웃하시면 돼요
영업시간은요?	마지막 손님은 오후 여덟시 반까지요
아메리카노 위에 커피 하얀 거 얹는 게 뭐죠?	휘핑크림이요
요 옷은 색상이 하나뿐인가요?	그 색이랑 블랙이랑 두 가지예요
네 어떤와인으로 드릴까요?	레드와인 2잔으로 부탁드립니다
저 혹시 여기서 주문돼요?	주문하세요
오늘 방 2개 있나요?	506호 507호 있어요.
기본 말고 더 준다는 거에요?	기본적으로 한 장은 올라가고 차슈 추가하면 더 올라가요
성인 2분이신가요?	성인 2명과 아기 1명이요
여기 매장은 국내 브랜드에요?	국내 브랜드 맞습니다
초크 가져다주세요	테이블로 가져다 들겠습니다
어떻게 이용하는 건가요?	머신에서 원하는 사용시간만큼 선결제하고 이용하시면 됩니다
그럼 어디에 주차하면 되나요?	옆에 있는 아파트 주차선에 주차하시면 됩니다
네 샘플도 많이 넣어주세요	최대한 많이 챙겨드릴게요
면접 때 신을 구두 보러 왔는데요	금방 가져오겠습니다
맥주 종류는 뭘로 나와요?	맥주 종류는 카스 하이트 둘 중에 하나 선택입니다
이거 공복에 먹어도 돼요?	공복에 먹으면 안돼요
원단을 가져오면은요?	원단을 가져오시면 가능합니다
실내복이에요?	앞에 있어요
당구장 영업시간이 언제까지 입니까?	11시부터 새벽3시까지에요
회색 제품 라지 사이즈로 입어 봐도 될까요?	가져다드릴게요
따뜻한 물 좀 주시겠어요?	정수기에서 직접 떠가시면 돼요
오징어 초무침은 많이 새그러워예?	오징어 초무침은 지금 떨어졌어요
에이드 다 생과일로 해주나요?	에이드는 생과일로 제조합니다
이거 할인 들어가는거죠	가능합니다
여기는 몇 시부터 몇 시까지 영업해요?	저희 열한 시부터 아홉 시까지 해요
지금 배달 가능 시각인가요?	가능하세요
딸기 얼마예요	양에 따라서 오천 원, 만 원, 이만 원 이에요.
여기 파는 건 항상 똑같은 거예요?	아니요. 가끔 바뀌어요.
그리고 혹시 눈에 좋은 영양제 있나요?	보통 루테인 들어간 거 많이 찾으세요
조런 티는 입어봐도 되나요?	저희 제품은 시착하실 수 없어요
지퍼는 가죽인가 보네요	그 부분은 가죽이에요
이제품 선물할건데 예쁘거 포장해주세요	그랬으면 좋겠네요
아뇨 여기 적립도 해요?	쿠폰 찍어 드릴게요
이번 주 토요일 예약을 하려는 데 가능할까요?	트윈 베드 룸으로 예약해드릴게요
네 그럼 5분 후에 제육볶음 세트 한 접시 제 자리로 가져다주세요	음식 주문은 좌석에서 온라인으로 주문하셔야 됩니다
어떤 거로 하실지 결정하셨나요?	알겠습니다
체크인 시간은 몇 시부터, 체크아웃 시간은 몇 시까지인가요?	체크인 시간은 네 시부터고 체크아웃 시간은 다음 날 오전 열두 시까지 하시면 돼요
여기 언제 오픈했어요?	1월 말이요
요런 옷은 얼마예요?	그 옷은 오만 원이에요
화장실은 이 안에 있어요?	밖에 있어요
숟가락은 없습니까?	숟가락 수저통 안에 보시면 있어요
오래 기다려야 해요?	조금만 있으면 자리 납니다 밖에서 기다려주세요
지금 순대전골은 1인분은 안 되죠?	1인분은 없습니다
지나가다 보니까 탈모 제품 광고가 보여서 들어왔는데, 약 복용하는 건가요?	먹는 약으로 보통 영양제 개념으로 보시는 게 맞습니다
1시간에 얼마인가요	10분에 1500원 1시간에 7천 원이요
핸드메이드 코트를 반코트로 줄일 수 있어요?	코트 같은 경우 직접 봐야 수선 여부를 알 수 있습니다
