8인실로 예약 가능한가요?	8인실은 예약 가능해요
나이 든 사람이 입어도 돼요?	고객님보다 나이 훨씬 많으신 분도 많으신데요
여기 만 2천 원이고 1시간 쓸게요	1번 자리 가시면 됩니다
메는 가방은 얼마예요?	그 가방은 삼만 구천 원이에요
통신사 할인되죠?	300원 할인됩니다
사각 쿠키로 20박스 주세요	사각 쿠키 20박스 준비해 드릴게요
드시고 가시나요?	먹고 갈 거예요
배달도 하시는가요?	저희는 홀 위주로 하고 배달은 방학 때만 가능해요
그거는 도우 두께 정할 수 있나요?	정할 수 있어요
소고기이신가요?	소고기 스테이크 용으로 먹으려고 해요
위치가 어디신데요?	멀지는 않아요. 이 근처에요
음료 주문 가능한가요?	자리에서 PC로 음료 주문 가능합니다
주차는 상가 지하에 주차하면 되나요?	주차권 드립니다
카페 이름이 1분이에요?	카페 1분입니다
프린트만 하려고 하는데 PC 사용료 내야 하나요?	프린트만 하실 경우에도 1시간 이용 요금 내셔야 합니다
요 빨간색 가방은 얼마예요?	요 빨간색 가방은 5만 원이에요
현금으로 구입하면 싸게는 안되나요	현금으로 구입하시면 좀 더 저렴해요
방 예약했는데, 확인 되나요?	룸은 7층 721호예요
네 피클1개와 콜라 추가해 주세요	주문 접수됐습니다
소고기는 불고기용 한 근에 얼마에요?	이만 사천 원이에요
안심, 3인분 치로 주세요	안심 3인분 치로 드릴게요
5시간 정액제 하려 하는데 어떻게 하는 거죠?	5시간 누르시고 결제방법 선택 후 결제하시면 됩니다
혹시 선결제도 가능한가요?	가능합니다.
바쁜가보네요	저녁시간이라 주문이 밀려있어요
티머니 이런 건?	됩니다
양지고기 얼마나 필요하신가요?	양지고기 한 근 주시면 될 거 같네요
시금치 무침이랑 콩나물 무침 2개하면 얼마죠?	5000원에 드릴게요
피자 중에 어떤 게 잘 나가나요?	고구마나 불고기 제일 많이 나가거든요
침구류도 주시는 거죠?	침구류 드려요
저런 옴므 종류는 어른들이 쓰는 거예요?	상관없어요, 나이가 아니라 피부에 따라 다른 거예요
쉬는 날은 없으시고요?	연중무휴입니다
사장님, 시루떡 주문할려면 쌀 안 갖고오면 얼마쯤 해요?	노란 시루떡 가격은 만칠천 원이에요
아 여기도 퀵으로 배달 됩니까?	됩니다.
오션뷰와 시티뷰가 있는데 어디로 드릴까요?	오션뷰로 부탁해요
밀크티에 우유를 넣는게 아니에요?	저희가 따로 그 맛을 내는 우유도 넣습니다
이 제품은 가격대가 어떻게 되죠?	지금 할인 이벤트 중이어서 10만 원에서 20프로 할인돼요
네 가격은 어떻게 되나요?	66000원입니다
수선하면 시간은 어느 정도 걸리나요?	3일 정도 시간이 필요합니다
체크아웃은 몇 시에요?	한시나 두시까지 계셔도 괜찮아요
삼겹살, 한돈인가요?	삼겹살은 국내산 돈이에요
송편은 안에 뭐가 들어있나요?	밤송편도 있고 깨송편도 있어요
설사는 안 하세요?	설사는 안 해요
혼자 먹을 건데 뭐가 맛있어요?	비빔밥하고 닭개장밖에 없어요
무슨 짬뽕이 맛있어요?	주로 해물이 제일 많이 나가죠
본인이 와야 되네?	착용한 모습을 확인 후 판단 할 수 있습니다
마들렌은 뭐가 맛있어요?	레몬 마들렌도 잘 나가고 홍차도 좋아하세요
화장실이 밖에 있어요?	밖에 있습니다
욕조도 있고요?	욕조 있어요
쉬림프 핫치킨 골드 피자 이건 치킨이에요?	이거는 새우와 핫치킨, 베이컨, 브로콜리가 올라가는 거예요
곱빼기는 얼마죠?	사천구백원 이요
어른들이 좋아하는 스타일이 뭔가요?	어른들은 보통 한우 불고기 아니면 클래식 치즈 버거, 좀 매콤한 거 좋아하시면 이거요
현미로 주세요	.
딸기 얼마씩 해요?	딸기 일 킬로에 팔천 원이에요
카드로 계산되죠?	카드 계산 되세요
주문하면 며칠 정도 걸리나요	하루 전까지는 이야기해 주시면 돼요
종이컵이랑 빨대 하나만 더 주면 안돼요?	종이컵과 빨대는 옆에 있습니다
커피는 시럽은 넣어드릴까요?	시럽넣지 말고 주세요
아메리카노 드릴까요?	아메리카노 한잔 주세요
선크림 기능도 있으면서 피부톤 정리해줄 수 있는 것도 있어요?	베이스 기능 포함된 거 있는데 조금 더 화사하게 쓸 수 있어요
샷은 몇 개 들어가죠?	샷은 한 개 들어가요
조금 작아 보이네요 다른 사이즈 있나요?	팔이 지금 가오리 핏이라서 짧아 보이시는 거예요
네이비 블랙 브라운 중 어떤 걸로 꺼내드릴까요?	이비로 한번 줘보세요
캠핑 추가 하려면 얼마인가요?	5만 원이에요
지금 있는 거는 떡국 떡 이고 옆에 있는 거는 뭐예요	쑥떡이요
혹시 와이파이 같은 건 설치되어 있나요?	당연히 와이파이 설치되어 있습니다
여기 몇 시에서 몇 시까지 영업하죠?	저희 일곱 시에서 열한 시 반 정도까지요.
대 다이 있나요?	대 다이는 지금 다른 손님이 사용하고 계세요
아까 저희 김치찌개 시켰는데 돼지찌개가 나왔어요	진짜요 죄송합니다 가격은 똑같은데요
반팔을 좀 보고 싶은데요	현재 반팔은 매진입니다
여성용 가방은 세탁 돼요?	핸드백 이런 종류는 세탁 안돼요
밝은 색으로 탈색하면 금갈색처럼 되나요?	89번 색도 이쁘네요
요즘 TV에 많이 나오는 워킹화는 어디에 있죠?	그건 A코너에 있습니다
어떤 요리 하실 건가요?	불고기이요
지금은 선생님께서 다른 분 레슨 가르치고 계세요?	지금은 경기 중이시고 끝나면 말씀 드릴 거에요
얼마나 들었어요?	100개 들었는데 하루에 한 개 드시면 되고 약하다 싶으면 두 개를 드셔도 돼요
설 쉬고 나서 과일은 많이 안 나가죠?	명절 바로 뒤에는 과일이 많이 안 나가요.
단체 여섯 명에서 일곱 명 오고 하면 따로 할인 안 되죠?	할인 안 됩니다
저기 운동화 말고 그냥 가죽 신발도 세탁돼요?	구두 종류도 돼요
10분당 얼마인가요?	1300원입니다
4명이 나란히 앉을 자리 있나요?	저쪽에 있습니다
볶음밥 하나 주시겠어요?	잠시만 기다려 주세요
된짱찌개에는 밥이 나오나요?	기본적으로 된장찌개에는 밥이 하나 있습니다
할인된 가격이에요?	오늘까지 할인 기간이에요.
처방전 돌려주시나요	처방전은 약국이 보관합니다
요 가방은 얼마쯤 해요?	그 가방은 구만 원이에요
사이즈 245로 보여주세요	잠시만 기다려주세요
지금 하는 떡은 몇 되쯤 돼요, 사장님?	이 떡은 넉 되예요
근처에 커피숍 있어요?	저 골목 나가서 왼쪽으로 가면 있어요
시루떡은 안 사실 건가요?	알겠습니다
시간은 얼마나 걸려요?	오분 안 걸릴걸요
그러면 여기 고 월매시장 뒤편에 그 빌라인데요 수거하고 배달은 안되시죠?	수거와 배달은 세탁물 5개 이상 돼야 가능합니다
네 현금 결제하시겠어요?	카드로 결제 해드릴께요.
그면 점심 때 들어갈라면 그 전날 전화드려야 되겠다 그지예?	예약해놓으면 그 시간에 맞춰서 보내드리죠
구경 좀 해볼게요 가방은 여기 있는 게 다인 가요?	가방 지금 세일해드리는 거예요 가죽이에요
얼마에요?	진미채 한 봉에 만 원이에요.
그럼 현금으로 결제할게요	알겠습니다
얼음량 조절 적게 되나요?	가능합니다
잘라드릴까요?	잠시만 기다려 주세요
해산물 크림은 해산물 어떤 게 들어가요?	꽃게 새우 홍합 이런 식으로 들어가요
네, 카드로 하실 건가요?	영수증은 버려주세요
저기 걸려있는 거 저런 거 가지고 해요?	저거는 돼지고기고 육회는 소고기로 해요
두 조각 정도 먹게 해야 하지 않겠어요? 초등학교 3학년인데	그러면은 5판하면 40조각 나오고 선생님하고 먹게 되면 한 판을 더 해야 할텐데요
여기 몇 시까지 열어놔요?	새벽 5시까지 해요
아기가 먹을 거라 기름이 적은 부위로 넣어주세요	기름이 적은 부위로 드릴게요
도라지무침하고 소고기장조림 한 팩씩 주시겠어요?	잠시만 기다려주세요
여기 예약제죠?	저희 매장은 예약 손님만 받고 있습니다
언제 주문하시는 거예요?	주문 도와드릴게요
빨간색 옷은 얼마예요?	그 옷 이만 오천 원이에요
당구대 자리 있나요	있습니다
저희 제품 찾아보셨어요?	알아보고 왔어요
음료에 이물질이 들어가 있어요	다시 만들어드릴게요
몇 시부터 영업하시죠?	이십사시에요
닥터지는 몇프로 세일이에요?	원래는 31000원인데 세일 해서 19970원이에요
커팅해주세요	쿠킹 칼 챙겨 드려요
여기 투톤 트리트먼트 적어놨는데요?	이거는 염색약이에요
흡연실도 따로 있나요?	흡연실 따로 있습니다
음식 주문은 자리에서 가능한가요?	즐거운 시간 되세요
네 5분 정도 걸리는데 괜찮은가요?	잠시 후 번호를 부르겠습니다
안녕하세요 딸기 들어온 거 있나요?	요즘 딸기가 제철이라 많이 들어왔어요.
앞머리도 자를까요?	그럼 시작하겠습니다
계좌 이체로는 계산 가능한가요?	계좌이체로도 계산은 안 됩니다
머리가 너무 많이 상해서 그런데 어느 정도 길이를 원하세요?	딱 가슴 아래까지만 내려왔으면 좋겠어요
검은색으로는 그거 말고는 없다고요?	헤나가 처음에는 검은색이 안 나와요
여기 화장실은 어디죠?	밖으로 나가서 좌측에 보면 있어요
그러면 블랙화이트는 단 것이 아예 안들어가는거에요?	사이즈가 큰 거는 많이 들어가고 작은 거는 적게 들어가고 다 달라요
거실 바닥에 까는 카펫 대자인데 세탁 얼마에요?	카펫 재질이 뻗뻗하고 크면 약 팔만 원에 가능합니다
컴퓨터 속도 빠른가요?	rtx2080을 장착하여 이보다 빠를 수 없습니다
사장님, 여기 혹시 곰탕은 안 팔아요?	곰탕은 없어요
다른 데는 남자 거 5만 원, 6만 원씩 하잖아요?	백화점 랩시리즈 같은 건 비싸기는 하죠
가격이 얼마에요?	6천 원입니다
그걸로 할인받고 카드로 결제해 주시겠어요?	할인카드 먼저 주시고 결제 도와드릴게요
욕실 용품은 다 들어가 있고요?	다 있어요
삼겹살 있나요?	삼겹살 있어요
착용해볼 수 있어요?	가능하세요
포켓볼도 칠 수 있나요?	가능합니다
다른 색상도 있나요?	로즈골드와 실버 색상 있습니다
한우 등뼈인가 동글동글한 거 있죠?	그게 사골이에요 이걸 자르면 동그랗게 보이죠
혼자 식사 가능해요?	신발 신고 들어오세요
요즘 좀 잘 나가는 가방 어떤 게 있어요?	보통 사이즈 보시면 이 디자인도 많이 나가요
이 제과점에서 다 직접 만들어요?	빵은 이 제과점에서 직접 만들어요
자몽에이드하고 카푸치노 주세요	13400원 결제해드리겠습니다
제가 지금 입은 롱패딩은 물 세탁 할 수 있는거에요?	택 보니까 물 세탁 가능하시네요
요즘에서는 어떤 게 더 잘 나가요? 그러면 십구 번 요거 맛있나요?	많이 나가요
현금영수증 가능한가요?	번호불러주세요
과일주스는 진짜 과일 갈아서 주는 거죠?	과일주스는 진짜 과일을 갈아서 드립니다
이 단팥빵은 언제까지 먹을 수 있나요?	단팥빵은 이틀 이내로 드시는 게 제일 좋아요
메뉴판에 있는 것 모두 주문 가능한가요?	모두 가능합니다
이거 염색하는 데는 얼마입니까?	뿌리 염색은 기본 6만 원입니다
샤인 머스캣 있어요?	샤인 머스캣은 없고, 청포도는 있어요.
향이 다르네요?	향도 다르고, 바이탈리티라고 해서 주름이랑 생기 케어 하는 거거든요
여기 콜라 다 떨어졌는데 리필 가능할까요?	아 지금 슈퍼에 가서 사 올게요
체크아웃은 언제 하면 되나요?	27일 오후 12시 전에 체크아웃 해 주세요
색상은 검은색뿐이에요?	검은색만 있어요
저 오렌지색 조거 얼마예요?	사만 원이에요
헤이즐넛도 시럽이에요?	헤이즐넛 시럽도 있습니다
W약을 얼마나 먹어야지	W약을 육개월에서 일년 정도 드셔야 몸에 저장철 형태로 저장이 됩니다
아침은 드시지 않았죠?	지금 공복 상태입니다
양복 바지 수선 가격대는 어떻게 되나요?	수선 정도에 따라 금액이 다르기 때문에 정확히 말씀드리기 어렵습니다
저한테 맞는 색상이 어떤 거예요?	23호가 맞는 색상이에요
어른들 몇 분 정도 계시는데요	30명 이상 될거예요
얼큰한 걸 좋아하세요 아니면 보통으로 좋아하세요?	좀 맵지 않았으면 좋겠는데 애가 있어가지고
독서실 이용할려면은 뭐 어떻게 해야 하는지?	좌석 종류가 많아서 설명해드리면 제일 오른쪽에 하루마다 자리 지정해서 앉는 오픈석, 버들리안, 칸막이 있는 캠브리지, 유캠브리지가 있는데 유캠브리지가 조금 더 높고 자리가 넓고, 작심, 유작심은 위아래만 뚫린 반 밀폐형 1인실인데 이것도 유작심이 조금 더 넓고, 시크릿룸이라고 해서 완전 밀폐형 1인실 이렇게 있습니다
사이즈 몇 신으세요?	저 삼십오요
아직 정해지진 않아서 잘 모르겠고 여기 시럽 한 번만 놔줄래요?	뒤편에 시럽 준비되어있습니다
한참 걸려요?	다 돼가요
할인되는 거라예?	할인됩니다
딱 붙는 쫄바지는 없죠?	쫄바지보다도 이런 바지가 더 붙어요
바지, 넓은 게 나아요 좁은 게 나아요?	고객님 취향따라 고르셔야죠
타이레놀은 처방받은걸로 구입하는 거에요?	그냥 구입할 수 있습니다
화장실은 어디에 있어요?	화장실은 바깥으로 나가셔서 바로 옆에 있습니다
네 그럼 두 개 사려는데 포인트로도 일부 결제 가능한가요?	앞쪽에 핸드폰 번호 찍어주시면 포인트 확인해드릴게요
하나에 4천원이요? 차라리 저게 낫지 않아요?	저것이 이것보다 나아요. 올해는 사과 값이 많이 올랐거든요
4인이 먹을 수 있을까요?	명 드시기엔 세트가 양이 적어요 네 명 드시려면 탕수육 중자는 가야죠
네 다른 거 더 필요하신 건 없으신가요?	30만 3000원입니다
보통 수선 작업하시는데 며칠 걸려요?	수선물이 많으면 오래 걸리고 적으면 삼일이면 수선됩니다
얼마인가요?	12000원입니다
이번 주에 예약 가능한 방이 있나요?	1층 4인실로 예약해드릴게요
배달료가 있는 거네요?	홀에서 드시는 거하고 배달 나가는 거하고 가격과 양이 틀립니다
좀 덜 단 게 바닐라 라떼에요?	고객님의 성향에 따라 다르겠지만, 바닐라 라떼에도 시럽이 들어갑니다
짬뽕은 곱빼기로 변경 가능한가요?	변경가능합니다
카카오 페이로 결제되나요?	가능합니다
물은 어디에 있어요?	창가 쪽에 있어요
배달도 가능해요?	가능합니다
사태를 넣으려고 하면 얼마에요?	사태는 크기별로 가격이 달라요
겨울에 물냉면 해요?	겨울에도 냉면 해요
이게 떨어져도 에이에스 다 된다 그죠?	갖고 오시면 붙여드려요
발이 좀 꽉 끼는 느낌이 드는데요?	구두는 꽉 끼는 느낌으로 신으셔야 합니다
음료는 괜찮으신가요?	사이다 하나 부탁드려요
기본에는 야채가 뭐 들어가요?	기본 당근 부추 우엉 이렇게요
세일은 언제까지 해요?	저희 이십사일까지 세일해요
얼마에요?	39,900원이에요
카푸치노랑 카페 모카랑 뭐가 다른가요?	카푸치노는 에스프레소에 우유넣고 위에 우유 거품, 시나몬을 뿌리고 카페 모카는 라떼에 초코시럽이 들어가고 위에 휘핑 크림이 올라가요
차돌박이는 얼마에요?	차돌박이는 500g에 7000원이요
이 옷은 원사이즈인가요?	그 옷 사이즈 많아요
요거는 얼마에요?	그거 구천원이에요
돈가스 만들 고기 부위 좀 추천해 주세요	돈가스는 안심, 등심이 좋아요
떡볶이 1인분 얼마에요?	3000원 입니다
텀블러 가져왔는데 여기에 담아주세요	알겠습니다
꼬마 눈물 김밥은 뭐예요?	매운 거예요
이게 숫자 적힌 게 사이즈입니까?	이거는 3번이니까 고객님에게 큰 거예요
스틱에서 뭐가 맛있어요?	아몬드 크림치즈가 제일 잘 나가거든요
한라봉은 요즘 얼마죠?	한 박스에 3만원입니다
며칠 걸려요?	모피는 시간이 좀 더 걸려요
어깨는 놔두고 고치면 얼마에요?	어깨 수선 빼고 수선비는 육만 원입니다
와이파이도 돼요?	와이파이 됩니다
몇 시에서 몇 시까지 영업을 하시는데예?	보통 문 여는 시간 12시에서 12시 반이고 저녁시간은 10시까지 합니다
여기 있는 건 다 국내산이죠?	국내산이에요
귤 종류가 다양하네요?	귤이 생긴 건 비슷해도 이름이 다 달라요.
이거 외국 브랜드에요?	아뇨 한국 브랜드에요
배 어느 쪽이 아파요?	약 드릴게요
새로운 신발들 좀 볼 수 있을까요?	이쪽으로 오시겠어요?
영수증도 같이 챙겨주시겠어요?	여기 카드와 영수증 드릴께요.
요금은 한 시간에 얼마네요?	한 시간에 1000원 입니다
포장하시겠어요?	먹고 갈 건데요
그럼 주문할 수 있을까요?	그럼 성함과 전화번호 주소를 적어주세요
일반실은 한 달에 얼마에요?	일반실은 한 달에 7만 원입니다
적립되는 카드 그런건 없죠?	그런 건 없어요
이게 조금 더 정장스러운 데 어떠세요?	이거는 소재가 광택이 좀 나네요
거기 킹왕짱 치킨 노형점 맞나요?	맞습니다.
포장은 여기서 먹는 거 보다 양이 좀 많은가?	반찬을 못 담아드리니까 포장은 여기서 잡수는 거보다 양이 좀 많지요
캐라반 가지고 오시게요?	캐라반 대여하려는데
계산이 카드로도 가능할까요?	카드로 계산 가능합니다
고 짬뽕이 많이 나가요?	아니면 담백하게 드시면 백짬뽕 많이 나가고요
오늘의 추천 메뉴는 그날 재료가 더 신선한 건가요?	그렇진 않고요 날씨에 따라서 저희가 결정하는 거예요
샴푸는 어떤 제품 사용하시나요?	샴푸도 탈모샴푸 사서 쓰고 있는 데 빠지네요
스킨 겸 에센스는 용량이 얼마예요?	스킨 겸 에센스는 대용량은 없고 이백 밀리에요
주차는 어디다 하나요?	지정된 주차장은 없습니다
주소 적어드릴께요	내일 모레까지 받아보실수 있으실꺼에요
색상은 어떤 색이 있나요?	갈색이나 와인색을 많이 하세요
물 세탁 자주하면 색이 좀 바래지는 거 같던데 드라이는 안그래요?	색 바래지는 거는 제품에 따라서 달라요
이것도 크림인가요?	미백 기능성 크림이고 촉촉해서 건조함 없이 바르실 수 있는 제품이에요
그럼 메뉴 좀 보여주세요	자리에서 화면으로 주문하시면 됩니다
염색하는데 시간은 얼마나 걸리죠?	약 30분 걸립니다
불고기버거 세트가 얼마죠?	5000원입니다
네, 어떤 방으로 드릴까요?	더블룸으로 키 드릴게요
바비큐 같은 거는?	4명이면 숯과 그릴 드리는데 2만원이에요. 고기는 사 오셔야 하고 양념은 다 있어요
불고기 필라프는 뭐예요?	볶음밥에 불고기가 올라간 메뉴에요
이거 하나 주세요	천은 서비스로 드릴게요
카카오페이 결제 가능한가요?	이버를 통해서 카카오페이 가능해요
카카오페이나 삼성페이도 가능할까요?	카카오페이나 삼성페이로 계산 가능합니다
이 신발은 얼마에요?	이건 가죽인데, 3만 5천원이에요
요금은 회원이랑 비회원이랑 다른가요?	비회원이 100원 더 비쌉니다
제일 잘 나가는 돈가스는 어떤 거예요?	포크 매콤 일식이 제일 잘나가요
색상은 요거 하나뿐이에요?	두 개에요
주스에 망고하고 뭐가 들어가요?	주스에는 오렌지랑 자몽이 들어가요
청포도 두 개 주시겠어요?	청포도 2개 포장해 드릴께요.
지금 짐 맡기고 이따 다시 와도 되나요?	짐 찾으실 때는 번호 키를 보여주시면 돼요
몇 시부터 체크인 가능하죠?	체크인은 오후 3시부터 가능해요
지금 바로 발급 가능하신데 만들어드릴까요?	잠시만 기다리시면 포장해드리겠습니다
오리털은 물세탁 하세요?	오리털은 물세탁을 합니다
바지 앞 지퍼 말씀인가요?	지금 그거 고장났거든요
옷 단추가 다 떨어져서 필요했는데 여기 단추가 얼마에요?	600원이에요
자몽을 금방 갈은 거예요?	담가진 자몽 청을 풀어서 제조했습니다
이거 현금으로 하면 더 싸요?	현금하시면 십이만 원까지 할인해드릴게요
잘 안 들어가는데요?	양말 두꺼워서 그런가봐요
인크레더블 이것도 고기가 닭고기 들어가요?	닭 다리 살, 닭 가슴살 이렇게 두 개 들어 있어요
이 가방 같은 디자인으로 다른 색도 있나요?	있습니다
겨울 거는 세일하시는 거 있으세요?	겨울 거는 반품했어요
핑크색 실내복 저거는 얼마예요?	3만 원 정도해요
혹시 카카오페이 결제는 되시나요?	다 돼요
펜션 근처에 관광지나 볼거리 있나요?	펜션이 보문관광단지랑 불국사도 가깝고 서로는 반대편에 있어요
굽이 몇 센티죠?	6센티인데 기능성으로 돼있어서 밖으로는 4센티밖에 안 돼 보여요
예약 한 사람인데, 확인 해주실래요?	위쪽 두 번째 텐트 이용하세요
화로 대여해주시나요?	대여비 2만 원이에요
네, 튀김은 전부 섞어드릴까요?	섞어주세요.
종일 요금은 얼마입니까?	10000원입니다
초는 몇 개나 드릴까요?	초는 큰 거 한 개만 주세요
수분이 좀 많은 스킨 보여 주세요	수분 스킨 여기 있어요
콩나물국밥 이거 좀 매워요?	그건 매워요
패티는 뭐예요?	돼지고기에요
여기 단체 주문하는 빵도 돼요	.
그 일주일 씩 있어도 해도 가격은 똑같고예?	같아요.
아이들과 먹기에 어떤 피자가 좋을까요?	콤비네이션 피자와 불고기 피자 추천드려요
여기 회원가입해야돼요?	자리에 가셔서 회원가입 하시면 돼요
스킨 겸 에센스, 가격은 어떻게 돼요?	이 제품은 육만구천 원, 이 제품은 팔만구천 원이에요
돈가스는 세 종류네요	일반 돈가스 있고 치즈 있고 고구마 있어요
모발을 먼저 하고 다음에는 두피를 별도로 하는 거죠?	그렇죠
딸기는 얼마예요?	딸기는 만 원이에요
컵라면, 햄버거, 콜라 결제 좀 해주세요	3900원입니다
관절이 안 좋은데 뭐가 좋나요?	관절이 안 좋으면 MSM이 더 좋습니다
요 곤색 가방은 얼마예요?	이 가방은 3만 원이에요
주차는 어디서 해요?	잠시는 괜찮은데 주말에는 또 괜찮아요
어떻게 해야 하죠?	치매 예방도 하고 순환시키는 약을 드셔야 합니다
그러면 주문할 때는 언제 전화드려야 돼요?	하루 전에요
상의 95 하의 30 사이즈로 주세요	잠시만 기다려 주세요
아이스 아메리카노와 따뜻한 아메리카노 가격 차이 있나요?	아메리카노는 아이스여도 추가 금액 받지 않습니다
여기는 시간당 얼마인가요?	1500원입니다
사이드메뉴 할인행사 하나요	지금 진행중인 행사는 없습니다
네 얼마나 기다려야 돼요?	2분 정도만 기다려주세요
소스는 근데 뭐 뭐 나오죠?	소스는 매운소스하고 머스터드 소스가 나와요
네 증상이 어떻게 되세요?	열이 조금 나고 목이 따가운 게 편도가 좀 부은 것 같아요
머리가 좀 길면 몇 만원 더 추가되는 거죠?	볼륨매직은 기장에 따라 가격이 다릅니다
물 좀 더 주실 수 있나요?	10분 내로 가져다드리도록 할게요
등심돈까스로 주세요	등심돈까스로 드릴게요
백설기 없나요?	백설기 아침 분량은 다 팔렸네요
평균적으로 얼마 하는지 알 수 있나요?	남자는 6만원부터 시작해요
여기 평일에도 예약해야 됩니까?	평일에도 예약 가능합니다
지금 가격이?	이거는 20프로 해드려서 삼십이만 오천사백 원이에요
세트 메뉴에 구성을 변경해도 되나요?	죄송하지만 그건 어렵습니다.
하루에 몇 번 먹어요?	매일 꾸준하게 하루에 한 번만 드시면 돼요
양복 다른 부분 수선은 안하세요?	소매, 길이, 바지 허리, 엉덩이 부분 수선은 가능합니다
뼈를 사용해서 또 끓인 거는 아니고요?	그 뼈를 가지고 사흘 내내 계속 끓이는 거예요
화장실은 어디로 가야 하나요?	나가서 왼쪽으로 가시면 됩니다
클럽 샌드위치도 하나 주세요	총 8500원입니다
요런 조끼는 얼마씩 해요?	이 옷이 삼만 이천 원이에요
냉면 돼요?	됩니다
이 신발은 보드라운 소재예요?	부드러운 가죽 소재로 나왔어요
