8인실로 예약 가능한가요?	8인실은 예약 가능해요
숫자 초 넣어주실 수 있나요?	숫자 초는 별도 구매해야 해요
현금으로 하면 좀 안 깎아줘요?	당연히 깎아줘야지요
피자 주문하면 얼마나 걸릴까요?	1시간정도 걸릴 거 같아요
전화번호만 말씀해드리면 돼요?	856422O
전화로 케익 예약도 가능한가요?	가능합니다
어디서 입어요?	저 끝에 가면 탈의실 있거든요
한 게임에 얼마나 하나요	5000원입니다
도금은 아니죠?	14k 금이에요
드시고 가세요?	아뇨
다음 주 언제쯤 되는데요?	월 화 수 중에 올 거예요
남자들도 에센스 이걸 사용하면 좋다고요?	괜찮으세요, 아침, 저녁으로 바르면 좋아요
네 어떤 메뉴로 하시겠어요?	스노윙치킨 순살로 주세요
아 순살로 부탁드릴게요	주문 감사합니다
염색은 얼마에요?	삼만원입니다
2인실에 침대 하나를 더 놓으면 조금 좁더라도 연속으로 한 방을 쓰실 수 있는데, 그렇게 해드릴까요?	2인실에 한 명 추가하면 가격도 조금 쌀 테니 그렇게 해주세요
미용실은 휴무가 언제예요?	격주로 월요일 쉬고 있어요
두통약 있나요?	있습니다.
A세트 구성이 뭐죠?	바베큐 폭립과 로제파스타와 레드와인이 나갑니다
햄버거를 포장해서 가면 금액 추가가 되나요?	포장 용기 때문에 1000원 추가 됩니다
성함이 어떻게 되세요?	홍길동이요
지금 자리가 꽉 차 있어요?	아니요, 여자전용 자리 남아있습니다
아리따움하고 이니스프리하고는 어떻게 달라요? 같은 회사예요?	같은 회사에요. 계열사에요. 포인트만 같이 공유합니다
맵지는 않죠?	많이 맵지는 않아요
색상은 이거 하나 뿐인가요?	이거 하나 뿐이에요.
포크 이거는 뭐 할라고 하시는데요?	저희 케이크가 있어서요.
떡은 언제까지 두고 먹을 수 있나요?	실온에서는 이틀 정도 먹을 수 있어요
더 필요한 건 없으세요?	가격이 궁금하네요
이 제품은 얼마예요?	이 제품, 19500원이에요
6명이 같이 앉을 수 있는 자리가 있나요?	있습니다.
제가 지갑을 놓고 나와서 그런데 외상으로 구매할 수 있나요?	외상은 받지 않아요
펜션에 바비큐장 말고 다른 거는 없죠?	펜션에 다른 건 없고, 준비해오셔야 해요
그럼 흰색 상품을 주문할 수 있나요?	주문 가능하십니다.
배달비는 따로 있나요?	없습니다
물건 좀 맡아주세요	이쪽으로 오시겠어요
여섯 명 자리가 남아있나요?	이쪽 자리 금방 치워드리겠습니다
스무디는 얼음 넣어서 갈은 거죠?	맞아요
순한 수분크림 있나요?	이쪽에 진열되어 있습니다.
한국에서 만들은 거네?	국산 겁니다.
가래떡 있나요	지금 만들고 있는 중입니다
커피 대신 추가 금액 내면 다른 음료도 가능한가요?	음료는 아메리카노만 가능해요
남자들 보통 무릎까지는 오죠?	무릎까지 덮습니다
조식이 뭐 어떤 음식이 나오나요?	조식이 저희는 뷔페식이에요
바깥에 기모 바지는 얼마씩 해요?	바지는 만 원이에요
프라이드 1마리 반도 가능할까요?	죄송합니다. 저희는 반마리는 판매를 안 해서요.
인당 추가요금은 얼마인가요?	5만 원이에요
일행분은 성인이신가요?	죄송하지만 일행분이 어려 보이셔서 신분증 검사 좀 할게요
그러면 다른 색으로도 사이즈가 없을까요?	지금 보시는 색상 말고 회색으로는 있습니다
포인트 적립하시나요?	전화번호 불러드리면 되나요?
주말에 가려고 하는데 예약할 수 있나요?	예약 도와드릴게요
선물용이라 맛을 보고 사고 싶은데 안 되나요?	그 쿠키는 시식이 준비되지 않아서 죄송해요
주차 공간이 잘 되어있나요?	지하와 지상에 주차장이 있어서 주차 공간은 여유로와요
커트하고 머리 감겨 주나요?	감겨드립니다.
샷 추가하면 돈이 얼마 추가 되나요?	기본 투샷이 들어가고, 샷 추가 하시면 500원이 추가 돼요
네 바퀴도 같이 죽는 건가요?	성분이 달라서 바퀴는 다른 약이 있습니다
신어봐도 되나요?	한 번 신어보세요
롱 이거는 얼마 정도예요?	뒤에 금액 적혀있어요
와이파이 비밀번호는 뭐예요?	와이파이 비밀번호는 종이에 써져있습니다
저 아메리카노 아직 안 나오나요?	손님이 많아서 지연되고 있습니다
주소가 어딥니까?	1511호 바로 갖다드릴게요
구워 먹기 좋은 고기 주세요	삼겹살이 구워 먹기에는 괜찮아요
밍크옷 수선도 해요?	밍크옷도 수선합니다
귀중품은 따로 보관 가능한가요?	귀중품은 데스크에 맡기실 수 있어요
정말 빨리 나오네요 여기는 문을 몇 시부터 몇 시까지 열어요?	문을 세시 반쯤 열어서 점심 저녁 팔고 한 여덟시 되면 문 닫아요
원산지는 어디 꺼죠?	이탈리아, 케냐, 만델리 있습니다
김밥3줄 떡복이2인분 튀김 섞어서2인분 포장해주세요	잠시만 기다려주세요
요즘은 컴퓨터로 주문하는데 자리에 앉으셔서 한번 보시고 주문해주세요	자주 와야겠어요
생수 좀 더 주실래요?	생수 더 준비해드릴게요
신세계 상품권 쓸 수 있죠?	가능합니다
소스 좀 더 주실 수 있나요?	여기요
그렇구나 배달에는 그러면 무하고 콜라하고 같이 들어가고요?	다섯 마리면 콜라는 들어가는데 고깃값도 비싸고 퀵까지 있어요 그래서 더 비싸죠
의논을 해보고 다시 전화드리도록 할게요	전화 주시면 이박에 어떤 방을 하시든 이만 원을 할인해 드릴게요
바비큐 준비는 미리 부탁드려야 하나요?	한 시간 전에 말씀해주시면 돼요
블루베리 머핀은 얼마인가요?	이천 원입니다
네 하나 주세요	여기 있습니다
주문하면 몇 분 정도 조리하나요?	십오분요
기다리시면서 색상표 보시겠어요?	그럼 가져다드릴게요
이게 스니커즈 종류죠 그죠?	그게 베스트입니다
이 천 가방은 좀 싼가요?	그 천 가방은 만원이에요
네 손님 체인과 가죽 어느쪽으로 보세요?	체인으로 장지갑이 들어갈 만한 크기로 보고 있어요
이거 가방끈은 없나요?	파우치 안에 있어요
누가 드실 건가요?	제가요
이거 모직 코트예요?	맞아요
드시고 가시나요?	규정상 매장에서는 머그컵으로 드리고 있어요
돌체라떼는 뭐에요?	커피종류입니다
바비큐 시설 이용할 수 있나요?	가능해요
그럼 팥빙수도 불가능한가요?	팥빙수 주문 가능하세요
네 알겠습니다 여기 명함이나 하나 없어요?	노란 거 하나 가져가세요
조식은 포함되어 있나요?	조식 포함 플랜으로 예약되어 있으세요
일반실과 특실이 있는데, 어느 방으로 드릴까요?	특실에서 묵고 가겠습니다
허리 묶는 거에요?	아뇨
짬뽕은 매운 거예요? 매운 게 고추짬뽕이죠?	고추짬뽕이 더 매운 거예요
여기 배달도 돼요?	배달은 아직 안 됩니다
가격은 다 비슷해요?	거의 비슷비슷해요
샴푸는 얼마예요?	샴푸는 2만원이에요
가방들 색깔이 좀 연하네	가방들 색감이 예뻐서 좋아하세요
내장된 굽이 몇센치인가요?	3센치입니다
포장할때 박스빼고 해주실 수 있으세요?	그렇게 해드릴게요
저희가 조금만 상의해보고 전화드리도록 하겠습니다	전화주시면 33만선으로 해드릴게요
혹시 복용하실 분이 몇 살인가요?	한달분이 삼만원입니다
집이 어딘데요?	이 근처
초는 몇 개 드릴까요?	초는 8개 주세요
얼마인가요?	1000원입니다
묵은지 광어 초밥 10p로 주문할게요	잠시만 기다려 주세요
봉툿값 얼마에요?	봉툿값은 50원이에요
샌드위치 만드는데 5분 정도 걸리는데 괜찮으세요?	기다릴게요. 포장은 안 해주셔도 괜찮아요
3미리로 밀어주세요	알았어요
양장피 35000원짜리 하면은 다른 거 뭐 주시나요?	만두 서비스요
그면 저는 파스타만 있으면 되는데	파스타만 하시면 6300원입니다
관절영양제 효과는 비싼 게 제일 나아요?	좋은 거 드시는 게 낫죠
케이크 같은건 없어요?	케이크는 아직 준비되지 않았습니다
국거리용으로 이게 나아요? 아니면 요게 나아요?	금액이 같으니까 둘 다 괜찮아요
물은 잘 나오나요?	물은 잘 나와요
끈이 따로 있어요?	원래 이 끈은 따로 파는데 지금 세트로 하고 있어요
여기 파마 얼마에요?	손님 기장은 14만 원이에요
꽃등심  이건 뭐죠?	이것은 스테이크를 슬라이스해서 볶음밥 위에 같이 드리는거라서 한 끼로는 제일 괜찮으실거 같아요
고춧가루가 안 들어 갔네요?	고춧가루 안 들어가요
따뜻한거 찾으세요?	상관 없어요
수분 크림을 사려고 하는데요	이 제품을 추천드려요
그럼 이걸로 부탁드립니다	잠시만 기다려주세요
혹시 문 닫는 날도 있나요?	또 오세요
할머니들 신발 맞추면 보통 가격이 얼마나?	보통 구두는 138000원에서 158000원 정도에요
이 카드로 계산할게요	8000원입니다
테이크아웃인가요?	매장에서 먹고 갈 거예요
앞에 진열되어 있는 떡이 전부인가요?	안에 더 있습니다
4명 자리 좀 주세요	지금 나가신 곳 정리해서 알려드릴게요
혹시 프린트도 가능한가요?	이용하다 궁금한 거는 채팅으로 물어보세요
닭을 한 마리 사려고 하는데 닭볶음탕용으로 잘게 토막 내 주실 수 있나요?	원하시면 닭볶음탕용으로 잘게 토막 내서 드려요
이걸로 예약해 주실래요?	알겠어요.
화장실은 저 위쪽이라 하셨지예?	화장실은 나가셔서 좌측편 계단 올라가시면 돼요
길이를 자르기만 하면 좀 이상하죠, 사장님?	경우에 따라 다르기 때문에 정확하게 말씀드릴 수 없습니다
회원가입하고 싶어요	저쪽 컴퓨터에서 직접 회원가입하시면 됩니다
제가 제일 좋은 상품으로 골라드려도 될까요?	딸기는 클수록 맛있으니까 이걸로 가져가세요.
계산해주세요	계산해드릴게요
처방약 중 속이 쓰린 약이 있나요?	노란색 알약이 쓰릴 수 있으니 식사 후 바로 드세요
그러면 장식용은요?	한 24만 원
몇 시에 오시려고요?	4시쯤으로 3박 예약해 드릴게요
지금은 가방 다 세일합니까?	전부 다 세일품목은 아니에요
주소가 어떻게 되시나요	서울 아파트 101동 1001호에요
고객님이 싫어하시거나 안 드시는 야채 말씀하시면 빼어드려요	야채는 다 좋아하는데요
아 그래요?	그렇습니다
모둠 초밥은 저거 다 들어가 있는 거예요? 우동은 주나요?	우동은 모든 메뉴에 포함되어 있어요
이거 각이 딱 잡혀있어요?	각 잡히는 디자인은 아니에요
김밥집 생긴지 오래됐어요?	십 년 넘었어요
다른 색깔도 있나요?	검정색과 베이지색이 있습니다
결제하면 바로 입실 가능한 거죠?	지금 대기인원이 있어서 입실하시려면 조금 기다리셔야 해요
7자라는 뜻이에요? 이거 맛있나요?	이게 제일 기본 메뉴예요
내일은 몇 시쯤에 계란말이 팔아요?	계란 재고가 없어서 내일 돼봐야 알 거 같아요
코트에 그림도 손으로 직접 그린 건가요? 프린트한 건가요?	저거 수입이고 하나씩 밖에 없는 옷입니다
이 티, 색상은 하나뿐인가요?	그 티는 한 칼라예요
근처에 편의점이나 슈퍼가 있나요?	캠핑장 주차장 왼편으로 50m 올라가시면 매점이 있어요
맛은 어때요?	맛은 새콤달콤해요.
사장님, 고 나이 드신 분 할머니들 신을 신발 또 뭐 있어요?	슬리퍼 말고는 다 신고 벗기가 똑같아요
이건 코르덴으로 나왔는 거는 겨울에 많이 들었겠다 그죠?	겨울에 쓰는 거죠
파마하는데 시간은 얼마나 걸릴까요?	넉넉하게 3시간 정도 걸릴 것 같아요
이 가방은 세탁을 어떻게 하나요?	손세탁 해주세요
포캣볼도 있나요?	포켓볼은 아쉽게도 아직 들어오지 않았어요
쿠션이 더 좋은 제품으로 신어보세요	꼭 오세요
커트랑 파마 가능한가요?	됩니다
아 되도록 창가석으로 배치해주세요	알겠습니다
여기 독서실 이용하려면 어떻게 해야돼요?	다른데랑 똑같이 요금내고 이용하시면 되는데 저희 이용시간은 아침 9시부터 새벽 1시까지에요
이 가방은 얼마에요?	각각 49000원입니다
이 모델이 행사하는 제품 맞죠?	맞습니다
이 라인은 로션 종류도 나와요?	이건 크림 같은 건데 바르는 치료 연고제라고 보시면 돼요
숯불구이 해먹을 수 있는 시설도 되어 있나요?	방앞에 개별 테라스에 바비큐 시설이 되어 있어요
커피 코지코히는 뭐예요?	커피 코지코히는 드립커피입니다
이거 드라이해야 해요?	드라이하면 좋지만 물세탁도 돼요
굽은 낮은거 찾아요?	굽은 조금 있으면 좋죠
그게 너무 비싸면 이건 어때요?	그건 별로 안좋아하실 거 같아요
제로페이 되나요?	가능합니다
이게 면세용 소재인가요?	이거는 스웨이드입니다
이거는 한방 아니죠	한방 맞아요. 태반이 든 한방 제품이에요. 스킨만 발라도 촉촉해요
이 빵은 전부 다 직접 만드신 거예요?	이 빵은 직접 만든 빵이에요
오월 칠, 팔, 구 일에 갈 예정인데 가족 단위로 갈 수 있는 방이 있나요?	저희가 예약식이라서 보신 펜션을 말씀해주시면 안내를 해드릴게요
영수증 주세요	잠시만 기다려주세요
13일 주말, 성인 2명이 묵으려고 하는데 숙박료가 얼마예요?	성인 2명 주말 금액은 12만원이에요
한 게임 당 얼마인가요?	포켓볼은 2000원, 4구는 2500원입니다
혹시 케이크에 레터링 가능한가요?	케이크는 예약제로 시행하고 있으며, 최소 5시간 전까지는 말씀해주셔야 해요
백팩이나 크로스백 둘 다 보여주세요	여기 있어요
치킨 한마리 피자 한 판 주문하면 얼마나 걸리나요?	오늘 연휴 기간이라 1시간 이상 걸립니다
체크인 해주실래요?	오션뷰 2박 예약하셨고 304호에요
새콤하고 맛있네요. 이런 맛의 귤이 늘 나오나요?	잠깐 나오고 조금 지나면 이런 새콤한 맛의 귤은 안 나와요.
한 번 써보시려고요?	풍성하게 보인다고 하니까, 괜찮은가 싶어서
앱 할인되는가요?	아뇨
오렌지랑 딸기 주세요.	오렌지랑 딸기 합쳐서 총 3만 원이에요.
이 서류가방으로 주세요	결제도와 드리겠습니다
아 장갑은 어디에 있어요?	저쪽 카운터 옆에 있습니다
제품은 외국제품 써요?	아뇨, 국산제품입니다
그러면 양념은 한 가지네요? 저번에 자주 시켜 먹었었는데	양념은 맞아요 한 가지에요 순살은 좀 보드라운 다리 살이고요
두 달 전에 오셨었네요	그땐 딸이랑 같이 왔었죠
편하시죠?	편하긴 한데 양가죽이 좀
1개만 주세요	총 3만원입니다
목살 두 근만 주세요	목살 두 근 준비할 동안 다른 것도 둘러보세요
배달은 안 되시지예?	배달은 11시부터 가능하세요
양복 바지도 수선해주세요?	양복 바지 수선 가능합니다
여기서 제일 맛있게 하는게 어떤 거에요?	아무거나 해도 비슷해요
네 출퇴근용으로 어떤 거 많이 해요?	출퇴근용으로는 이런 거 많이 해요
저거는 부작용이 없나요?	없는 거예요
특굴뚝배기는 뭐예요?	굴이 더 추가된 거예요
아이스티는 얼마인가요	1500원입니다
어린애가 포함되어 있는데 놀 만한 공간이 있나요?	아이가 놀 만한 곳이 마당은 있는데 놀이터는 없어요
계추 하기 전에는 미리 전화를 해야 되나요?	예약하시고 오셔야 돼요
늦게 갈 수도 있는데 몇 시까지 입장 가능한가요?	12시 전에 오시면 됩니다
예 현금하면 천원빠진다고 했죠?	이만삼천원 입니다
신발은 세탁 되나요?	죄송합니다만 신발은 세탁하지 않습니다
이거는 얼마예요?	27만 9천 원이요
가격은 어떻게 되나요?	20만 원 정도부터 있습니다
폼클렌징 제품도 있어요?	폼클렌징 제품은 저쪽에 있어요
음료수 시켜야 되는 거예요?	그런데 서비스로 드릴게요
언제부터 아프셨어요	어젯밤부터 그런 거 같아요
여기는 밤 자체를 그냥 넣으시는거에요?	밤라떼 맛있을 거에요
몇 인분 정도 주문 하시는데요?	한 사십 명 정도요
감기몸살인 거 같은데 약 좀 주세요	영약이랑 물약같이 드릴게요
색은 푸른색이라든지 카키색 같은 색 밖에 안 나와요?	카키색 같은 경우는 특수 염색이라 가격이 비싸요
나이대가 어떻게 되세요?	고등학교 2학년이요
얼마에요?	6500원이요
온누리상품권은 받으시는 가요?	안 받아요
4분 예약이시네요	맞아요
네 어떤걸로 해드릴까요?	짜장면 4개 준비해주세요
한라봉은 요즘이 철이에요?	한라봉 철이에요
체크아웃은 몇 시인가요?	11시에 체크아웃 하셔야 해요
혹시 무지개떡도 있나요?	아뇨 무지개떡은 없습니다.
회원가입할게요	PC에 앉아서 신청할 수 있습니다
앞다리 사태 족발은 수육 해놓으면 맛있어요?	수육은 앞다리 사태 족발 부위가 제일 맛있죠
요거는 지금 얼마 정도에요?	가죽인데도 이렇게 싸요
이 제품은 마트에도 있나요	마트에는 없어요
오일리 한 제품말고 다른 제품은 없나요?	저자극으로 나온 제품이라 순해요
어떤 게 잘 나가요?	이런 쪽으로 이것과 크로스 연결된 거 많이 찾으세요
어디 앉으면 될까요?	편하신 데 앉으세요
비싼 약은 보험이 안되나 봐요?	아뇨, 보험 적용된 가격이고, 지금 드리는 위장약이랑, 무좀약 하루 두 번 식후에 드시고, 약 드실때 술은 드시지 마세요
체크아웃 시간은요?	체크아웃은 다음 날 11시에요
혹시 샘플 몇 개 주실 수 있으신가요?	드릴게요
음료 뭐 뭐 있어요?	음료는 커피나 셰이크나 다 가능하세요
맵스터 치킨 한마리 부탁드립니다	알겠습니다
김장김치는 키로당 얼마 하는데요?	김장김치는 포기로 큰 건 2만원씩 해요, 킬로그램으로 하는 것보다 나아요
직접 갖고 와야 해요?	직접 방문 하셔야 됩니다
젓갈 종류는 한 통에 얼만데요?	한통에 4000원 씩이에요.
키를 하나 더 받을 수 있나요?	하나 더 드릴게요
카드 무이자 가능한가요?	12개월 무이자 가능합니다.
이거 소재가 뭐예요?	세무입니다
음식이나 필요한 건 어떻게 주문하나요?	다른 거 필요하신 거 있으시면 컴퓨터로 말씀해주세요
가벼운 것 위주로 보여주세요	1학년이 사용하는거라 가볍게 나왔어요
패딩조끼 이 색깔밖에 없나요?	패딩조끼 검정색이랑 밤색 브라운색밖에 없어요
비회원도 사용이 가능한가요?	비회원도 사용 가능합니다
그럼 세탁도 되고 수선도 되고 다 된단 말씀이시죠?	수선 하고 운동화 세탁도 하고 전부 뭐 다 해요
등뼈에도 가격이 다른 게 있어요?	돼지고기 등급에 따라 가격차이가 있어요
와사비는 좀 적게 해주세요	와사비 따로 나가요
수저는 어디 있어요?	여기 있습니다
송편 안에는 뭐 들어가요	깨송편이에요.
샌드위치 데워주기도 하나요?	데워드려요
주차는 어디에 해야 하죠?	지하주차장 이용해주시면 돼요
사장님 여기 흡연 가능한가요?	흡연구역은 따로 있습니다
십육 일 일박 이일로 이용요금이 얼마 정도 되나요?	주말, 두 분이시면 십구만원 방이 있어요
조금 달달한건 어떤거 있어요?	녹차라떼라고 연유 들어간거 있구요 바날라라떼 모카라떼 카라멜 마끼야또 아니면 초콜렛 들어가는 초콜렛 모카랑 카페모카있습니다
바다 쪽 뷰 꼭 원하시나요?	바다 쪽 이면 좋습니다
이거 몇 번 끊어가지고 하면 조금 더 싼가요?	몇 번 끊으면은 제가 일회 무료로 드릴게요, 할인되는 거죠
시럽 조금만 넣을까요?	3000원 결제하겠습니다
이거 세무예요?	세무는 아니고 그냥 합성피혁입니다
배달료는 얼마인가요?	2000원 입니다
이번 봄 신상 나왔나요?	신상은 이쪽에 있습니다
뭐가 제일 맛있어요?	다 맛있어요
곰보빵에 크림 넣을 수 있나요?	곰보빵에 크림 넣어 드려요
밀감 한 박스가 몇 킬로에요?	밀감 한 박스 삼 킬로예요
천연염색은 감물말고 뭘로 염색해요?	천연염색은 백년초, 양파, 쑥 등으로 해요
정액제 발급받으려면 얼마에요?	만 원부터 있어요
하루하면 얼마에요?	하루에 5천 원입니다
뚱뚱한 사람이라 목이 짧아서 모자 달린 걸 싫어하시던데?	칼라가 있고 모자가 있으면 별론데, 이중이 아니라 바로 목이라서 괜찮아요
밍크하고 가죽은 수선하는 것도 비싸죠?	비싸다고 알고 있습니다
예약했는데 확인 좀 해주실래요?	객실은 2006호실 오션뷰에요
여기 할인카드나 적립카드 있나요?	없어요
제품은 괜찮은데 조금 더 싼 건 없을까요?	이 모델도 한 번 발라드릴게요
이 도라지무침 구입하면 얼마나 두고 먹을 수 있어요?	저건 식초가 들어가서 빨리 변하지 않아 한참 두고 먹을 수 있어요
황태 해장국 하나 주세요	황태 해장국이요
너무 비싼 옷 말고 조금 저렴한 제품 없어요?	요런 제품은 칠십프로 세일이라 싸요
이거는 몇 분정도 돌아가요?	이건 35분 기본인데 넣으신 거에 따라서 좀 더 추가하셔도 되고 500원씩 더 넣으시면 5분 더 추가돼요
복층 펜션 있나요?	있어요
오늘 파마 가능한가요?	앞 손님 때문에 20분 정도 기다리셔야 해요
언제 도축된 고기입니까?	오늘 바로 도축되어서 온 고기예요
문은 언제 열어요?	11시에 오픈합니다
이 제품 M사이즈로 하나 주세요	죄송하지만 해당 사이즈는 품절입니다
이거는 얼만데요?	그거는 세트로 11만 9천 원입니다
틴트는 여기 있는 게 전부인가요?	맞아요
1시간에 얼마인가요?	한 시간에는 1200원이고 열 시간 충전하시면 10000원이에요
파마하려는데 요즘 어떤 거 하면 좋을까요?	볼륨 파마 또는 롤 스트레이트 파마를 추천합니다
치킨 가라아게 얼마나 걸려요?	그건 튀김이라서 한 5분정도 걸릴건데요
딸기 스무디 한 잔 주세요	죄송합니다 오늘 딸기가 소진돼서 딸기 음료는 주문이 안되세요
저처럼 키가 작은 사람들은 어떻게 입어요?	청바지 입으시고 위에 블라우스 입으시면 됩니다
안 씻고 그냥 먹어도 되나요?	흙이 묻어 있을 수도 있으니 씻어 드시는 것이 좋아요.
네 짬뽕국물도 서비스 부탁드려요	넣어드릴께요
예약명수는 당일에 바꿔도 괜찮은가요?	물론입니다
음료도 같이 포장해드릴까요?	같이 포장해주세요
몇 시에 체크아웃 하면 되나요?	낮 12시까지는 체크아웃하셔야 해요
죄송한데 영수증 하나만 해주시면 안될까요?	조금만 계세요 금방 드릴게요
음식 주문은 어떻게 하면 되나요?	자리 가셔서 컴퓨터로 주문하세요
오늘 2시 예약했는데요	두분 자리 안내 해드리겠습니다
금은 없나요	아 알겠습니다
이거 검은 티 얼마예요?	이거 3만 2천 원인데 세일해서 2만 5천 원요
수퍼맥스가 보스웰리아 성분이 더 많이 든거에요?	아뇨, 여러가지 성분이 골고루 알차게 들었다고 보시면 됩니다
헤드폰에서 소리가 잘 안 나오는데 어쩌죠?	다른 걸로 바꿔드리겠습니다
만약에 곡물을 사기만 하면 어떻게 돼요?	사면은 이거를 한 개 만오천원에 팔아요
분홍색 66사이즈 주시겠어요?	준비해 드리겠습니다
프린터기 사용되나요?	됩니다
그럼 식빵이랑 앙버터 포장해주세요	알겠습니다.
일반 김밥으로 한 줄 포장해주세요	결제 도와드리겠습니다
요 핑크색 티도 이쁜데 얼마예요?	그 핑크색 티는 육만 오천이에요
세면도구는 구비가 되어있죠?	세면도구는 다 되어 있고 칫솔만 가져오면 돼요
현금영수증 처리해주세요	번호 부탁드리겠습니다
의논해서 연락 한번드릴게요. 명함 하나 주시겠어요?	저희가 명함이 따로 없어서 핸드폰으로 연락주세요.
달달한 케이크는 뭐가 있나요?	복숭아 케이크가 달아서 잘 나가요
물비빔국수가 어떤 거예요?	그거는 하절기용이라서 지금은 안해요
립 에센스, 발라봐도 돼요?	립 에센스 발라보셔도 돼요
앞접시도 주실 수 있으신가요?	앞접시도 같이 드리겠습니다
빨대는 어디 있나요?	이쪽에 있습니다
그 정도는 아니고 초기에 다리 아픈 건데	기본 영양제로 드릴 테니 아플 때만 드시면 됩니다
